{
  "version": 1,
  "comfyui": {
    "base_url": "http://127.0.0.1:8188",
    "request_timeout_seconds": 45,
    "max_parallel_jobs": 1,
    "mcp_command": "comfy-mcp",
    "cli_command": "comfy",
    "data_root": null
  },
  "blender": {
    "expected_mcp_server": "blender"
  },
  "workspace": {
    "default_root": null
  }
}
